[
  {
    "ts": "2025-08-11T12:00:00Z",
    "run_id": "demo-001",
    "shot": 1,
    "module": "QuantumLens",
    "odmr_contrast": 0.31,
    "t2_star_us": 1.6,
    "t1_ms": 4.8,
    "photon_counts": 305000,
    "gamma_r": 0.5,
    "Sigma_max": 0.92,
    "Delta": 0.18,
    "epsilon_t": 0.22,
    "lambda": 0.01,
    "T_index": 0.88,
    "threshold_crossings": { "T_0_5": 62.4, "T_0_1": 148.2 },
    "notes": "protected"
  },
  {
    "ts": "2025-08-11T12:00:01Z",
    "run_id": "demo-001",
    "shot": 2,
    "module": "GraphReadout",
    "odmr_contrast": 0.29,
    "t2_star_us": 1.4,
    "t1_ms": 4.9,
    "photon_counts": 297500,
    "gamma_r": 1.0,
    "Sigma_max": 0.90,
    "Delta": 0.22,
    "epsilon_t": 0.22,
    "lambda": 0.01,
    "T_index": 0.73,
    "threshold_crossings": { "T_0_5": 41.7, "T_0_1": 129.9 },
    "notes": "unprotected"
  },
  {
    "ts": "2025-08-11T12:00:02Z",
    "run_id": "demo-001",
    "shot": 3,
    "module": "MW-Antenna",
    "odmr_contrast": 0.32,
    "t2_star_us": 1.7,
    "t1_ms": 5.1,
    "photon_counts": 310200,
    "gamma_r": 0.7,
    "Sigma_max": 0.91,
    "Delta": 0.20,
    "epsilon_t": 0.22,
    "lambda": 0.01,
    "T_index": 0.80,
    "threshold_crossings": { "T_0_5": 50.2, "T_0_1": 140.5 },
    "notes": "pulse sweep"
  },
  {
    "ts": "2025-08-11T12:00:03Z",
    "run_id": "demo-001",
    "shot": 4,
    "module": "GraphGate.16",
    "odmr_contrast": 0.28,
    "t2_star_us": 1.5,
    "t1_ms": 4.7,
    "photon_counts": 290100,
    "gamma_r": 1.0,
    "Sigma_max": 0.89,
    "Delta": 0.21,
    "epsilon_t": 0.22,
    "lambda": 0.01,
    "T_index": 0.71,
    "threshold_crossings": { "T_0_5": 39.9, "T_0_1": 128.0 },
    "notes": "unprotected, calibration sweep"
  },
  {
    "ts": "2025-08-11T12:00:04Z",
    "run_id": "demo-001",
    "shot": 5,
    "module": "PKS",
    "odmr_contrast": 0.33,
    "t2_star_us": 1.8,
    "t1_ms": 5.2,
    "photon_counts": 315300,
    "gamma_r": 0.5,
    "Sigma_max": 0.93,
    "Delta": 0.19,
    "epsilon_t": 0.22,
    "lambda": 0.01,
    "T_index": 0.90,
    "threshold_crossings": { "T_0_5": 65.1, "T_0_1": 151.0 },
    "notes": "protected, Ramsey"
  }
]


